{
  "fixture_id": "T04-AUTH-401",
  "contract_version": "1.1.0",
  "description_ko": "외부 출처가 인증을 거절한 응답: auth를 기록한다.",
  "virtual_now": "2026-08-24T10:01:00.000Z",
  "transport": {
    "mode": "http",
    "status": 401,
    "delay_ms": 20,
    "deadline_ms": 1500,
    "headers": { "content-type": "application/json" }
  },
  "payload": { "message": "unauthorized synthetic fixture" },
  "expected": {
    "freshness": "stale",
    "error_code": "auth",
    "row_count": 1,
    "stored_value": 105,
    "delta": null,
    "preserve_last_good": true
  }
}
