{
  "fixture_id": "T04-SCHEMA-BREAK",
  "contract_version": "1.1.0",
  "description_ko": "HTTP 성공이지만 필수값 타입이 바뀐 응답: schema_error를 기록한다.",
  "virtual_now": "2026-08-24T10:04:00.000Z",
  "transport": {
    "mode": "http",
    "status": 200,
    "delay_ms": 20,
    "deadline_ms": 1500,
    "headers": { "content-type": "application/json" }
  },
  "payload": {
    "signal_id": "aleph-demo-index",
    "normalized_value": "105",
    "unit": "pt",
    "source_name": "ALEPH 결정론 replay",
    "source_url": "https://fixtures.aleph.invalid/t04/demo-index",
    "source_time": null,
    "fetched_at": "2026-08-24T10:04:00.000Z",
    "record_timezone": "Asia/Seoul",
    "record_date": "2026-08-24"
  },
  "expected": {
    "freshness": "stale",
    "error_code": "schema_error",
    "row_count": 1,
    "stored_value": 105,
    "delta": null,
    "preserve_last_good": true
  }
}
