{
  "fixture_id": "T04-NORMAL-D1-A",
  "contract_version": "1.1.0",
  "description_ko": "가상 1일차 첫 정상 조회: 새 일별 행을 만든다.",
  "virtual_now": "2026-08-24T00:00:00.000Z",
  "transport": {
    "mode": "http",
    "status": 200,
    "delay_ms": 20,
    "deadline_ms": 1500,
    "headers": { "content-type": "application/json" }
  },
  "payload": {
    "signal_id": "aleph-demo-index",
    "normalized_value": 100,
    "unit": "pt",
    "source_name": "ALEPH 결정론 replay",
    "source_url": "https://fixtures.aleph.invalid/t04/demo-index",
    "source_time": "2026-08-23T23:59:00.000Z",
    "fetched_at": "2026-08-24T00:00:00.000Z",
    "record_timezone": "Asia/Seoul",
    "record_date": "2026-08-24"
  },
  "expected": {
    "freshness": "fresh",
    "error_code": "none",
    "row_count": 1,
    "stored_value": 100,
    "delta": null,
    "preserve_last_good": true,
    "record_date": "2026-08-24"
  }
}
